[
 {
  "source_id": "p-1001",
  "knowledge_base": "catalogo",
  "type": "product",
  "locale": "es",
  "title": "Hamburguesas de ternera premium (pack 6)",
  "text": "Hamburguesas de ternera premium (pack 6). Pack de seis hamburguesas de ternera de 150 g cada una, ideales para barbacoa. Recomendado: una por persona. Conservar refrigerado. Categoría: Carnes para barbacoa. Marca: Campo Norte.",
  "canonical_url": "http://localhost:8000/demo/producto.html?id=p-1001",
  "acl": [
   "public"
  ],
  "version": "1",
  "metadata": {
   "product_id": "p-1001",
   "variation_id": "p-1001-v1",
   "sku": "P-1001",
   "price_amount": 11.95,
   "currency": "EUR",
   "category": "Carnes para barbacoa",
   "brand": "Campo Norte",
   "availability": "En stock",
   "image_url": "/demo/img/carnes.svg",
   "image_alt": "Hamburguesas de ternera premium (pack 6)"
  }
 },
 {
  "source_id": "p-1002",
  "knowledge_base": "catalogo",
  "type": "product",
  "locale": "es",
  "title": "Costillas de cerdo adobadas 1 kg",
  "text": "Costillas de cerdo adobadas 1 kg. Costillas de cerdo adobadas listas para la parrilla. Un kilo rinde para tres o cuatro personas en una barbacoa. Categoría: Carnes para barbacoa. Marca: Campo Norte.",
  "canonical_url": "http://localhost:8000/demo/producto.html?id=p-1002",
  "acl": [
   "public"
  ],
  "version": "1",
  "metadata": {
   "product_id": "p-1002",
   "variation_id": "p-1002-v1",
   "sku": "P-1002",
   "price_amount": 9.5,
   "currency": "EUR",
   "category": "Carnes para barbacoa",
   "brand": "Campo Norte",
   "availability": "En stock",
   "image_url": "/demo/img/carnes.svg",
   "image_alt": "Costillas de cerdo adobadas 1 kg"
  }
 },
 {
  "source_id": "p-1003",
  "knowledge_base": "catalogo",
  "type": "product",
  "locale": "es",
  "title": "Brochetas de pollo y verduras (pack 8)",
  "text": "Brochetas de pollo y verduras (pack 8). Ocho brochetas de pollo marinado con pimiento y cebolla. Se hacen en diez minutos a la brasa. Categoría: Carnes para barbacoa. Marca: Granja Sol.",
  "canonical_url": "http://localhost:8000/demo/producto.html?id=p-1003",
  "acl": [
   "public"
  ],
  "version": "1",
  "metadata": {
   "product_id": "p-1003",
   "variation_id": "p-1003-v1",
   "sku": "P-1003",
   "price_amount": 8.75,
   "currency": "EUR",
   "category": "Carnes para barbacoa",
   "brand": "Granja Sol",
   "availability": "En stock",
   "image_url": "/demo/img/carnes.svg",
   "image_alt": "Brochetas de pollo y verduras (pack 8)"
  }
 },
 {
  "source_id": "p-1004",
  "knowledge_base": "catalogo",
  "type": "product",
  "locale": "es",
  "title": "Hamburguesas vegetales de garbanzo (pack 4)",
  "text": "Hamburguesas vegetales de garbanzo (pack 4). Hamburguesas vegetarianas y veganas de garbanzo y espinaca, aptas para barbacoa. Sin frutos secos. Categoría: Alternativas vegetarianas. Marca: VerdeVivo.",
  "canonical_url": "http://localhost:8000/demo/producto.html?id=p-1004",
  "acl": [
   "public"
  ],
  "version": "1",
  "metadata": {
   "product_id": "p-1004",
   "variation_id": "p-1004-v1",
   "sku": "P-1004",
   "price_amount": 5.95,
   "currency": "EUR",
   "category": "Alternativas vegetarianas",
   "brand": "VerdeVivo",
   "availability": "En stock",
   "image_url": "/demo/img/alternativas.svg",
   "image_alt": "Hamburguesas vegetales de garbanzo (pack 4)"
  }
 },
 {
  "source_id": "p-1005",
  "knowledge_base": "catalogo",
  "type": "product",
  "locale": "es",
  "title": "Brochetas de tofu y verduras (pack 6)",
  "text": "Brochetas de tofu y verduras (pack 6). Brochetas vegetarianas de tofu ahumado, calabacín y tomate cherry. Opción vegana para barbacoa. Categoría: Alternativas vegetarianas. Marca: VerdeVivo.",
  "canonical_url": "http://localhost:8000/demo/producto.html?id=p-1005",
  "acl": [
   "public"
  ],
  "version": "1",
  "metadata": {
   "product_id": "p-1005",
   "variation_id": "p-1005-v1",
   "sku": "P-1005",
   "price_amount": 6.4,
   "currency": "EUR",
   "category": "Alternativas vegetarianas",
   "brand": "VerdeVivo",
   "availability": "En stock",
   "image_url": "/demo/img/alternativas.svg",
   "image_alt": "Brochetas de tofu y verduras (pack 6)"
  }
 },
 {
  "source_id": "p-1006",
  "knowledge_base": "catalogo",
  "type": "product",
  "locale": "es",
  "title": "Mazorcas de maíz dulce (pack 4)",
  "text": "Mazorcas de maíz dulce (pack 4). Cuatro mazorcas de maíz dulce para asar en la barbacoa. Guarnición vegetariana. Categoría: Guarniciones. Marca: Huerta Clara.",
  "canonical_url": "http://localhost:8000/demo/producto.html?id=p-1006",
  "acl": [
   "public"
  ],
  "version": "1",
  "metadata": {
   "product_id": "p-1006",
   "variation_id": "p-1006-v1",
   "sku": "P-1006",
   "price_amount": 2.99,
   "currency": "EUR",
   "category": "Guarniciones",
   "brand": "Huerta Clara",
   "availability": "En stock",
   "image_url": "/demo/img/guarniciones.svg",
   "image_alt": "Mazorcas de maíz dulce (pack 4)"
  }
 },
 {
  "source_id": "p-1007",
  "knowledge_base": "catalogo",
  "type": "product",
  "locale": "es",
  "title": "Ensalada de patata casera 1 kg",
  "text": "Ensalada de patata casera 1 kg. Ensalada de patata con huevo y cebollino, lista para servir. Rinde para seis personas. Categoría: Guarniciones. Marca: Huerta Clara.",
  "canonical_url": "http://localhost:8000/demo/producto.html?id=p-1007",
  "acl": [
   "public"
  ],
  "version": "1",
  "metadata": {
   "product_id": "p-1007",
   "variation_id": "p-1007-v1",
   "sku": "P-1007",
   "price_amount": 4.5,
   "currency": "EUR",
   "category": "Guarniciones",
   "brand": "Huerta Clara",
   "availability": "En stock",
   "image_url": "/demo/img/guarniciones.svg",
   "image_alt": "Ensalada de patata casera 1 kg"
  }
 },
 {
  "source_id": "p-1008",
  "knowledge_base": "catalogo",
  "type": "product",
  "locale": "es",
  "title": "Pan de hamburguesa brioche (pack 12)",
  "text": "Pan de hamburguesa brioche (pack 12). Doce panecillos de brioche para hamburguesas. Tostar ligeramente en la parrilla. Categoría: Guarniciones. Marca: Horno Real.",
  "canonical_url": "http://localhost:8000/demo/producto.html?id=p-1008",
  "acl": [
   "public"
  ],
  "version": "1",
  "metadata": {
   "product_id": "p-1008",
   "variation_id": "p-1008-v1",
   "sku": "P-1008",
   "price_amount": 3.2,
   "currency": "EUR",
   "category": "Guarniciones",
   "brand": "Horno Real",
   "availability": "En stock",
   "image_url": "/demo/img/guarniciones.svg",
   "image_alt": "Pan de hamburguesa brioche (pack 12)"
  }
 },
 {
  "source_id": "p-1009",
  "knowledge_base": "catalogo",
  "type": "product",
  "locale": "es",
  "title": "Agua mineral 1,5 L (pack 6)",
  "text": "Agua mineral 1,5 L (pack 6). Pack de seis botellas de agua mineral natural de litro y medio. Calcula un litro por persona en verano. Categoría: Bebidas. Marca: Fuente Azul.",
  "canonical_url": "http://localhost:8000/demo/producto.html?id=p-1009",
  "acl": [
   "public"
  ],
  "version": "1",
  "metadata": {
   "product_id": "p-1009",
   "variation_id": "p-1009-v1",
   "sku": "P-1009",
   "price_amount": 2.7,
   "currency": "EUR",
   "category": "Bebidas",
   "brand": "Fuente Azul",
   "availability": "En stock",
   "image_url": "/demo/img/bebidas.svg",
   "image_alt": "Agua mineral 1,5 L (pack 6)"
  }
 },
 {
  "source_id": "p-1010",
  "knowledge_base": "catalogo",
  "type": "product",
  "locale": "es",
  "title": "Refresco de limón 33 cl (pack 12)",
  "text": "Refresco de limón 33 cl (pack 12). Doce latas de refresco de limón sin azúcares añadidos. Bebida para fiestas y barbacoas. Categoría: Bebidas. Marca: Citrus.",
  "canonical_url": "http://localhost:8000/demo/producto.html?id=p-1010",
  "acl": [
   "public"
  ],
  "version": "1",
  "metadata": {
   "product_id": "p-1010",
   "variation_id": "p-1010-v1",
   "sku": "P-1010",
   "price_amount": 5.6,
   "currency": "EUR",
   "category": "Bebidas",
   "brand": "Citrus",
   "availability": "En stock",
   "image_url": "/demo/img/bebidas.svg",
   "image_alt": "Refresco de limón 33 cl (pack 12)"
  }
 },
 {
  "source_id": "p-1011",
  "knowledge_base": "catalogo",
  "type": "product",
  "locale": "es",
  "title": "Cerveza sin alcohol 33 cl (pack 12)",
  "text": "Cerveza sin alcohol 33 cl (pack 12). Doce botellines de cerveza sin alcohol. Servir muy fría. Categoría: Bebidas. Marca: Malta Clara.",
  "canonical_url": "http://localhost:8000/demo/producto.html?id=p-1011",
  "acl": [
   "public"
  ],
  "version": "1",
  "metadata": {
   "product_id": "p-1011",
   "variation_id": "p-1011-v1",
   "sku": "P-1011",
   "price_amount": 7.9,
   "currency": "EUR",
   "category": "Bebidas",
   "brand": "Malta Clara",
   "availability": "En stock",
   "image_url": "/demo/img/bebidas.svg",
   "image_alt": "Cerveza sin alcohol 33 cl (pack 12)"
  }
 },
 {
  "source_id": "p-1012",
  "knowledge_base": "catalogo",
  "type": "product",
  "locale": "es",
  "title": "Carbón vegetal de encina 5 kg",
  "text": "Carbón vegetal de encina 5 kg. Saco de cinco kilos de carbón vegetal de encina para barbacoa. Suficiente para dos o tres sesiones de parrilla. Categoría: Encendido y carbón. Marca: BrasaPro.",
  "canonical_url": "http://localhost:8000/demo/producto.html?id=p-1012",
  "acl": [
   "public"
  ],
  "version": "1",
  "metadata": {
   "product_id": "p-1012",
   "variation_id": "p-1012-v1",
   "sku": "P-1012",
   "price_amount": 7.99,
   "currency": "EUR",
   "category": "Encendido y carbón",
   "brand": "BrasaPro",
   "availability": "En stock",
   "image_url": "/demo/img/encendido.svg",
   "image_alt": "Carbón vegetal de encina 5 kg"
  }
 },
 {
  "source_id": "p-1013",
  "knowledge_base": "catalogo",
  "type": "product",
  "locale": "es",
  "title": "Pastillas de encendido ecológicas (32 uds)",
  "text": "Pastillas de encendido ecológicas (32 uds). Pastillas de encendido de fibra de madera natural, sin olores. Encendido de carbón en diez minutos. Categoría: Encendido y carbón. Marca: BrasaPro.",
  "canonical_url": "http://localhost:8000/demo/producto.html?id=p-1013",